{"format":"axiom-platform-protocol-meta-result-v1","formatVersion":1,"vectorId":"HPR-ACTION-RECEIPT-02","boundaryMode":"OUT_OF_PROCESS","status":"REJECTED","checks":[{"name":"contract-oracle","status":"PASS"},{"name":"first-divergence","status":"PASS"}],"firstDivergence":{"category":"DUPLICATE_COMPLETION","location":"action.completion"}}
